[
  {
    "id": "VASTU-CHINTAMANI-001::4dc998a3be::e001",
    "topic": "principles",
    "subcategory": "Land Selection / Land Shape (भूमि के प्रकार)",
    "claim": "जो भूमि दक्षिण, पश्चिम, नैऋत्य तथा वायव्य दिशा में ऊंची हो तथा ईशान में नीची हो तो उसे गजपृष्ठ भूमि कहते हैं। यह भूमि गृह स्वामी को धन, आयु तथा लाभ देती है।",
    "description": "Land that is elevated in the south, west, south-west (नैऋत्य) and north-west (वायव्य), and low in the north-east (ईशान), is called Gaj Prishtha Bhumi.",
    "direction": "E,W,N,S,NE,SW,NW",
    "room": "",
    "element": "",
    "planet": "",
    "remedy": "",
    "conditions": [],
    "source": {
      "source_id": "VASTU-CHINTAMANI-001",
      "title": "Vastu Chintamani",
      "author": "",
      "chapter": "Khand II (भूमि से सम्बंधित) / भूमि का चयन / भूमि के लक्षण",
      "page": "",
      "original_text": "जो भूमि दक्षिण, पश्चिम, नैऋत्य तथा वायव्य दिशा में ऊंची हो तथा ईशान में नीची हो तो उसे गजपृष्ठ भूमि कहते हैं। यह भूमि गृह स्वामी को धन, आयु तथा लाभ देती है।"
    },
    "language": "hi",
    "confidence": 0.9,
    "verification_status": "unverified"
  },
  {
    "id": "VASTU-CHINTAMANI-001::293f624eae::e002",
    "topic": "principles",
    "subcategory": "Land Selection / Land Shape (भूमि के प्रकार)",
    "claim": "यह भूमि मध्य में ऊंची तथा चारों ओर नीची होती है। ऐसी भूमि पर वास्तु निर्माण करने से प्रतिदिन घर में उत्साह, सुख तथा धन धान्य की विपुलता होती है।",
    "description": "Land that is elevated in the middle and low on all four sides is called Kurma Prishtha Bhumi.",
    "direction": "",
    "room": "",
    "element": "",
    "planet": "",
    "remedy": "",
    "conditions": [],
    "source": {
      "source_id": "VASTU-CHINTAMANI-001",
      "title": "Vastu Chintamani",
      "author": "",
      "chapter": "Khand II (भूमि से सम्बंधित) / भूमि का चयन / भूमि के लक्षण",
      "page": "",
      "original_text": "यह भूमि मध्य में ऊंची तथा चारों ओर नीची होती है। ऐसी भूमि पर वास्तु निर्माण करने से प्रतिदिन घर में उत्साह, सुख तथा धन धान्य की विपुलता होती है।"
    },
    "language": "hi",
    "confidence": 0.9,
    "verification_status": "unverified"
  },
  {
    "id": "VASTU-CHINTAMANI-001::dbb5d32f99::e003",
    "topic": "defects",
    "subcategory": "Land Selection / Land Shape (भूमि के प्रकार)",
    "claim": "पूर्व, आग्नेय तथा ईशान दिशा में ऊंची तथा पश्चिम दिशा में नीची होती है, वह भूमि दैत्य पृष्ठ भूमि कही जाती है। ऐसी भूमि पर वास्तु निर्माण से धन, जल तथा परिवार की सुख शांति की हानि होती है।",
    "description": "Land that is elevated in the east, south-east (आग्नेय) and north-east (ईशान), and low in the west, is called Daitya Prishtha Bhumi.",
    "direction": "E,W,N,S,NE,SE",
    "room": "",
    "element": "water",
    "planet": "",
    "remedy": "",
    "conditions": [],
    "source": {
      "source_id": "VASTU-CHINTAMANI-001",
      "title": "Vastu Chintamani",
      "author": "",
      "chapter": "Khand II (भूमि से सम्बंधित) / भूमि का चयन / भूमि के लक्षण",
      "page": "",
      "original_text": "पूर्व, आग्नेय तथा ईशान दिशा में ऊंची तथा पश्चिम दिशा में नीची होती है, वह भूमि दैत्य पृष्ठ भूमि कही जाती है। ऐसी भूमि पर वास्तु निर्माण से धन, जल तथा परिवार की सुख शांति की हानि होती है।"
    },
    "language": "hi",
    "confidence": 0.9,
    "verification_status": "unverified"
  },
  {
    "id": "VASTU-CHINTAMANI-001::14840bdad7::e004",
    "topic": "defects",
    "subcategory": "Land Selection / Land Shape (भूमि के प्रकार)",
    "claim": "पूर्व और पश्चिम दिशा में लंबी, उत्तर दक्षिण दिशा में ऊंची तथा बीचों-बीच जो भूमि नीची होती है उस भूमि को नाग पृष्ठ भूमि कहते हैं। ऐसी भूमि पर वास्तु निर्माण करने से उद्वेग, मृत्यु भय, स्त्री-पुत्रादि को मरण तुल्य कष्ट तथा शत्रु वृद्धि होती है।",
    "description": "Land that is long in the east-west direction, elevated along the north-south axis, and low in the middle, is called Naag Prishtha Bhumi.",
    "direction": "E,W,N,S",
    "room": "",
    "element": "",
    "planet": "",
    "remedy": "",
    "conditions": [],
    "source": {
      "source_id": "VASTU-CHINTAMANI-001",
      "title": "Vastu Chintamani",
      "author": "",
      "chapter": "Khand II (भूमि से सम्बंधित) / भूमि का चयन / भूमि के लक्षण",
      "page": "",
      "original_text": "पूर्व और पश्चिम दिशा में लंबी, उत्तर दक्षिण दिशा में ऊंची तथा बीचों-बीच जो भूमि नीची होती है उस भूमि को नाग पृष्ठ भूमि कहते हैं। ऐसी भूमि पर वास्तु निर्माण करने से उद्वेग, मृत्यु भय, स्त्री-पुत्रादि को मरण तुल्य कष्ट तथा शत्रु वृद्धि होती है।"
    },
    "language": "hi",
    "confidence": 0.9,
    "verification_status": "unverified"
  },
  {
    "id": "VASTU-CHINTAMANI-001::c7c67d1620::e005",
    "topic": "principles",
    "subcategory": "Land Slope (भूमि का ढलान)",
    "claim": "'पुव्वेसाणुत्तरंबुवहा' अर्थात् पूर्व, ईशान एवं उत्तर की और जल प्रवाह हो तो वह भूमि परिवार के लिए अत्यंत सुख-शांति एवं समृद्धिदायक होती है। (वास्तुसार प्र.1)",
    "description": "Vastusara states that if the natural water flow / slope of land is toward the east, north-east (ईशान) and north, that land brings great happiness, peace and prosperity to the family.",
    "direction": "E,N,NE",
    "room": "",
    "element": "water",
    "planet": "",
    "remedy": "",
    "conditions": [],
    "source": {
      "source_id": "VASTU-CHINTAMANI-001",
      "title": "Vastu Chintamani",
      "author": "",
      "chapter": "Khand II (भूमि से सम्बंधित) / भूमि का चयन",
      "page": "",
      "original_text": "'पुव्वेसाणुत्तरंबुवहा' अर्थात् पूर्व, ईशान एवं उत्तर की और जल प्रवाह हो तो वह भूमि परिवार के लिए अत्यंत सुख-शांति एवं समृद्धिदायक होती है। (वास्तुसार प्र.1)"
    },
    "language": "hi",
    "confidence": 0.9,
    "verification_status": "unverified"
  },
  {
    "id": "VASTU-CHINTAMANI-001::57c844bd9a::e006",
    "topic": "defects",
    "subcategory": "Land Slope (भूमि का ढलान)",
    "claim": "पश्चिम, वायव्य और नैऋत्य दिशा की ओर जमीन का उतार होने पर वह भूमि परिवार के लिए निष्प्रयोजन व्ययकारी होने से अर्थ संकट को प्रदान करती है।",
    "description": "If the land slopes down toward the west, north-west (वायव्य) or south-west (नैऋत्य), it causes wasteful expenditure and financial difficulty.",
    "direction": "W,N,S,SW,NW",
    "room": "",
    "element": "",
    "planet": "",
    "remedy": "Level land so downward slope faces east/north-east/north rather than west/south-west/north-west.",
    "conditions": [],
    "source": {
      "source_id": "VASTU-CHINTAMANI-001",
      "title": "Vastu Chintamani",
      "author": "",
      "chapter": "Khand II (भूमि से सम्बंधित) / भूमि का चयन",
      "page": "",
      "original_text": "पश्चिम, वायव्य और नैऋत्य दिशा की ओर जमीन का उतार होने पर वह भूमि परिवार के लिए निष्प्रयोजन व्ययकारी होने से अर्थ संकट को प्रदान करती है।"
    },
    "language": "hi",
    "confidence": 0.9,
    "verification_status": "unverified"
  },
  {
    "id": "VASTU-CHINTAMANI-001::0221ed672b::e007",
    "topic": "defects",
    "subcategory": "Land Slope (भूमि का ढलान)",
    "claim": "दक्षिण, आग्नेय दिशा में उतार होने से अचानक धन नाश, वंश नाश, विनाश, मृत्यु की प्राप्ति होती है।",
    "description": "A slope toward south or south-east (आग्नेय) causes sudden loss of wealth, destruction of lineage, and death.",
    "direction": "E,S,SE",
    "room": "",
    "element": "",
    "planet": "",
    "remedy": "",
    "conditions": [],
    "source": {
      "source_id": "VASTU-CHINTAMANI-001",
      "title": "Vastu Chintamani",
      "author": "",
      "chapter": "Khand II (भूमि से सम्बंधित) / भूमि का चयन",
      "page": "",
      "original_text": "दक्षिण, आग्नेय दिशा में उतार होने से अचानक धन नाश, वंश नाश, विनाश, मृत्यु की प्राप्ति होती है।"
    },
    "language": "hi",
    "confidence": 0.9,
    "verification_status": "unverified"
  },
  {
    "id": "VASTU-CHINTAMANI-001::b27bff546e::e008",
    "topic": "defects",
    "subcategory": "Land Slope (भूमि का ढलान)",
    "claim": "नैऋत्य एवं वायव्य में उतार होने पर परिवार के लिए अनेकों रोगों की उत्पत्ति होती है।",
    "description": "A slope toward south-west (नैऋत्य) or north-west (वायव्य) causes the origination of many diseases in the family.",
    "direction": "W,N,S,SW,NW",
    "room": "",
    "element": "",
    "planet": "",
    "remedy": "",
    "conditions": [],
    "source": {
      "source_id": "VASTU-CHINTAMANI-001",
      "title": "Vastu Chintamani",
      "author": "",
      "chapter": "Khand II (भूमि से सम्बंधित) / भूमि का चयन",
      "page": "",
      "original_text": "नैऋत्य एवं वायव्य में उतार होने पर परिवार के लिए अनेकों रोगों की उत्पत्ति होती है।"
    },
    "language": "hi",
    "confidence": 0.9,
    "verification_status": "unverified"
  },
  {
    "id": "VASTU-CHINTAMANI-001::4274336a9d::e009",
    "topic": "defects",
    "subcategory": "Land Shape / Topography",
    "claim": "भूमि के मध्य में गड्ढा होने पर सर्वनाश होता है।",
    "description": "If there is a depression / pit at the centre of the land, it causes total destruction (सर्वनाश).",
    "direction": "center",
    "room": "",
    "element": "",
    "planet": "",
    "remedy": "Fill any central depression before building.",
    "conditions": [],
    "source": {
      "source_id": "VASTU-CHINTAMANI-001",
      "title": "Vastu Chintamani",
      "author": "",
      "chapter": "Khand II (भूमि से सम्बंधित) / भूमि का चयन",
      "page": "",
      "original_text": "भूमि के मध्य में गड्ढा होने पर सर्वनाश होता है।"
    },
    "language": "hi",
    "confidence": 0.9,
    "verification_status": "unverified"
  },
  {
    "id": "VASTU-CHINTAMANI-001::654e59973c::e010",
    "topic": "principles",
    "subcategory": "Land Testing (भूमि परीक्षण विधि)",
    "claim": "चउवीसंगुलभूमी खणेवि पूरिज्ज पुण वि सा गत्ता। तेणेव महियाए हीणाहि यसमफला णेया।। (वास्तुसार प्र.1 गाथा 3)",
    "description": "Dig a pit of 24 finger-widths (अंगुल) in length, width and depth at the centre of the proposed land, then refill it with the same excavated soil. If soil remains extra after refilling, the land is best (उत्तम); if it is exactly level, it is medium (मध्यम); if the soil falls short, the land is inferior (अधम).",